Symbol,Name,Last Sale,Net Change,% Change,Market Cap,Country,IPO Year,Volume,Sector,Industry
JQC,Nuveen Credit Strategies Income Fund Shares of Beneficial Interest,$5.62 ,0.02,0.36%,0,United States,2003,583220,Finance,Finance Companies
JRI,Nuveen Real Asset Income and Growth Fund Common Shares of Beneficial Interest,$11.65 ,0.11,0.95%,0,United States,2012,90332,Finance,Finance Companies
JRS,Nuveen Real Estate Income Fund Common Shares of Beneficial Interest,$7.53 ,0.099,1.33%,0,United States,2001,98096,Finance,Finance/Investors Services
JRSH,Jerash Holdings (US) Inc. Common Stock,$3.04 ,-0.01,-0.33%,37376314,United States,2018,10747,Consumer Discretionary,Apparel
JRVR,James River Group Holdings Ltd. Common Shares,$7.92 ,0.07,0.89%,299580075,Bermuda,2014,515772,Finance,Property-Casualty Insurers
JSM,Navient Corporation 6% Senior Notes due December 15 2043,$19.52 ,0.2,1.04%,2182819100,United States,,27033,Finance,Finance: Consumer Services
JSPR,Jasper Therapeutics Inc. Common Stock,$24.52 ,-0.62,-2.47%,369897760,United States,2020,66163,Health Care,Biotechnology: Pharmaceutical Preparations
JSPRW,Japer Therapeutics Inc. Warrants,$0.20 ,-0.0025,-1.24%,3017111,United States,2020,865,Health Care,Biotechnology: Biological Products (No Diagnostic Substances)
JTAI,Jet.AI Inc. Common Stock,$0.64 ,0.0107,1.70%,8134107,Cayman Islands,2021,241684,Consumer Discretionary,Transportation Services
JTAIW,Jet.AI Inc. Warrant,$0.04 ,-0.0001,-0.25%,0,Cayman Islands,2021,44,Consumer Discretionary,Transportation Services
JTAIZ,Jet.AI Inc. Merger Consideration Warrants,$0.38 ,0,0.00%,4834158,Cayman Islands,,110,Consumer Discretionary,Transportation Services
JUNE,Junee Limited Ordinary Shares,$4.32 ,0.01,0.23%,54925716,Hong Kong,2024,8500,,
JVA,Coffee Holding Co. Inc. Common Stock,$1.34 ,0,0.00%,7649523,United States,2005,38797,Consumer Staples,Packaged Foods
JVSA,JV SPAC Acquisition Corp. Class A Ordinary Share,$10.13 ,-0.01,-0.10%,0,China,2024,12178,,
JVSAR,JV SPAC Acquisition Corp. Right,$0.38 ,0,0.00%,0,China,2024,10,,
JVSAU,JVSPAC Acquisition Corp. Unit,$10.55 ,0,0.00%,0,China,2024,50,,
JWEL,Jowell Global Ltd. Ordinary Shares,$1.06 ,-0.01,-0.94%,2300704,China,2021,830,Consumer Discretionary,Other Consumer Services
JWN,Nordstrom Inc. Common Stock,$22.29 ,-0.72,-3.13%,3639025679,United States,,2239693,Consumer Discretionary,Clothing/Shoe/Accessory Stores
JWSM,Jaws Mustang Acquisition Corp. Class A Ordinary Shares,$11.11 ,0,0.00%,0,,2021,1214,Finance,Blank Checks
JXJT,JX Luxventure Limited Common Stock,$1.23 ,0.02,1.65%,7457726,China,2013,10691,Consumer Staples,Apparel
JXN,Jackson Financial Inc. Class A Common Stock ,$72.90 ,-2.56,-3.39%,5559671042,United States,2021,465543,Finance,Life Insurance
JXN^A,Jackson Financial Inc. Depositary Shares each representing a 1/1000th interest in a share of Fixed-Rate Reset Noncumulative Perpetual Preferred Stock Series A,$26.57 ,-0.03,-0.11%,,United States,,18164,,
JYD,Jayud Global Logistics Limited Class A Ordinary Shares,$0.69 ,0.0149,2.22%,14626273,China,2023,1641630,Consumer Discretionary,Oil Refining/Marketing
JYNT,The Joint Corp. Common Stock,$15.14 ,0.32,2.16%,226704997,United States,2014,92222,Miscellaneous,Multi-Sector Companies
JZ,Jianzhi Education Technology Group Company Limited American Depositary Shs,$1.87 ,-0.045,-2.36%,37645025,China,2022,9852,Real Estate,Other Consumer Services
JZXN,Jiuzi Holdings Inc. Ordinary Shares,$0.33 ,-0.0085,-2.52%,38723948,China,2021,773344,Consumer Discretionary,Retail-Auto Dealers and Gas Stations
K,Kellanova Common Stock,$60.48 ,0.59,0.99%,20677122850,United States,,3037812,Consumer Staples,Packaged Foods
KA,Kineta Inc. Common Stock,$0.43 ,-0.047,-9.85%,5269416,United States,2016,75760,Health Care,Biotechnology: Pharmaceutical Preparations
KACL,Kairous Acquisition Corp. Limited Ordinary Shares,$11.95 ,-0.02,-0.17%,0,Malaysia,2022,200,Finance,Blank Checks
KACLR,Kairous Acquisition Corp. Limited Rights,$0.11 ,-0.0207,-15.84%,0,Malaysia,2022,68378,Finance,Blank Checks
KACLU,Kairous Acquisition Corp. Limited Unit,$12.00 ,0.01,0.08%,0,Malaysia,2021,1537,Finance,Blank Checks
KACLW,Kairous Acquisition Corp. Limited Warrants,$0.01 ,0.0012,10.00%,0,Malaysia,2022,599,Finance,Blank Checks
KAI,Kadant Inc Common Stock,$275.37 ,-4.56,-1.63%,3233655040,United States,1992,79049,Industrials,Industrial Machinery/Components
KALA,KALA BIO Inc. Common Stock,$6.74 ,-0.0339,-0.50%,18971916,United States,2017,7106,Health Care,Biotechnology: Pharmaceutical Preparations
KALU,Kaiser Aluminum Corporation Common Stock,$92.06 ,-3.95,-4.11%,1479296766,United States,,107204,Industrials,Metal Fabrications
KALV,KalVista Pharmaceuticals Inc. Common Stock,$11.86 ,-0.25,-2.06%,500353191,United Kingdom,2015,219491,Health Care,Biotechnology: Pharmaceutical Preparations
KAR,OPENLANE Inc. Common Stock,$17.11 ,-0.08,-0.47%,1853047408,United States,2009,800747,Consumer Discretionary,Retail-Auto Dealers and Gas Stations
KARO,Karooooo Ltd. Ordinary Shares,$29.05 ,-0.46,-1.56%,899129629,Singapore,2021,7164,Technology,Computer Software: Prepackaged Software
KAVL,Kaival Brands Innovations Group Inc. Common Stock,$1.39 ,-0.09,-6.08%,3979573,United States,,54708,Consumer Discretionary,Other Consumer Services
KB,KB Financial Group Inc,$55.95 ,-1.6,-2.78%,21186241009,South Korea,,67112,Finance,Commercial Banks
KBDC,Kayne Anderson BDC Inc. Common Stock,$16.10 ,-0.01,-0.06%,0,,2024,126141,,
KBH,KB Home Common Stock,$68.84 ,-2.12,-2.99%,5226002712,United States,1986,1177329,Consumer Discretionary,Homebuilding
KBR,KBR Inc. Common Stock,$62.48 ,-2.06,-3.19%,8389542050,United States,2006,1474411,Industrials,Military/Government/Technical
KC,Kingsoft Cloud Holdings Limited American Depositary Shares,$2.74 ,-0.01,-0.36%,695098689,China,2020,841460,Technology,Computer Software: Prepackaged Software
KCGI,Kensington Capital Acquisition Corp. V Class A Ordinary Shares,$11.08 ,-0.02,-0.18%,0,,2021,731252,Finance,Blank Checks
KD,Kyndryl Holdings Inc. Common Stock,$26.05 ,-0.46,-1.74%,6004875034,United States,2021,1983741,Technology,EDP Services
KDLY,Kindly MD Inc. Common Stock,$2.92 ,0.26,9.77%,0,United States,2024,73796,Health Care,Medical/Nursing Services
KDLYW,Kindly MD Inc. Warrants,$0.58 ,0.084,16.80%,0,United States,2024,22695,Health Care,Medical/Nursing Services
KDP,Keurig Dr Pepper Inc. Common Stock,$34.82 ,0.45,1.31%,47201096256,United States,,9057895,Consumer Staples,Beverages (Production/Distribution)
KE,Kimball Electronics Inc. Common Stock,$21.97 ,-0.52,-2.31%,546376456,United States,,68909,Technology,Electrical Products
KELYA,Kelly Services Inc. Class A Common Stock,$22.03 ,-0.07,-0.32%,782543470,United States,,235718,Consumer Discretionary,Professional Services
KELYB,Kelly Services Inc. Class B Common Stock,$22.00 ,0,0.00%,781477818,United States,,4,Consumer Discretionary,Professional Services
KEN,Kenon Holdings Ltd. Ordinary Shares,$25.82 ,0.07,0.27%,1362414118,Singapore,2015,15248,Utilities,Electric Utilities: Central
KEP,Korea Electric Power Corporation Common Stock,$7.45 ,-0.06,-0.80%,9565264747,South Korea,1994,165743,Utilities,Electric Utilities: Central
KEQU,Kewaunee Scientific Corporation Common Stock,$41.70 ,0.9,2.21%,119891837,United States,,12628,Industrials,Medical Specialities
KEX,Kirby Corporation Common Stock,$118.55 ,-1.74,-1.45%,6911465000,United States,,629038,Consumer Discretionary,Marine Transportation
KEY,KeyCorp Common Stock,$13.87 ,-0.25,-1.77%,13077474608,United States,,12782595,Finance,Major Banks
KEY^I,KeyCorp Depositary Shares Each Representing a 1/40th Ownership Interest in a Share of Fixed-to-Floating Rate Perpetual Non-Cumulative Preferred Stock Series E,$23.87 ,-0.54,-2.21%,,United States,,46662,,
KEY^J,KeyCorp Depositary Shares each representing a 1/40th ownership interest in a share of Fixed Rate Perpetual Non-Cumulative Preferred Stock Series F,$21.05 ,0.29,1.40%,,United States,,25099,,
KEY^K,KeyCorp Depositary Shares each representing a 1/40th ownership interest in a share of Fixed Rate Perpetual Non-Cumulative Preferred Stock Series G,$20.59 ,-0.09,-0.44%,,United States,,43913,,
KEY^L,KeyCorp Depositary Shares each representing a 1/40th ownership interest in a share of Fixed Rate Perpetual Non-Cumulative Preferred Stock Series H,$22.46 ,-0.29,-1.28%,,United States,,46086,,
KEYS,Keysight Technologies Inc. Common Stock,$135.84 ,-1.17,-0.85%,23709410090,United States,2014,1233205,Industrials,Industrial Machinery/Components
KF,Korea Fund Inc. (The) New Common Stock,$23.48 ,-0.1199,-0.51%,0,United States,,3807,Finance,Investment Managers
KFFB,Kentucky First Federal Bancorp Common Stock,$3.32 ,0.09,2.79%,26887734,United States,2005,664,Finance,Savings Institutions
KFRC,Kforce Inc. Common Stock,$62.19 ,-0.3,-0.48%,1212145290,United States,1995,86438,Consumer Discretionary,Professional Services
KFS,Kingsway Financial Services Inc. Common Stock (DE),$7.94 ,-0.05,-0.63%,221696496,Canada,,44490,Finance,Property-Casualty Insurers
KFY,Korn Ferry Common Stock,$65.37 ,-0.25,-0.38%,3411022223,United States,1999,191901,Consumer Discretionary,Diversified Commercial Services
KGC,Kinross Gold Corporation Common Stock,$7.67 ,-0.42,-5.19%,9426297317,Canada,2001,21291598,Basic Materials,Precious Metals
KGEI,Kolibri Global Energy Inc. Common stock,$3.51 ,-0.02,-0.57%,125045810,United States,,24525,Energy,Oil & Gas Production
KGS,Kodiak Gas Services Inc. Common Stock,$26.26 ,-0.51,-1.91%,2213564143,United States,2023,333789,Utilities,Natural Gas Distribution
KHC,The Kraft Heinz Company Common Stock,$35.63 ,0.53,1.51%,43265444225,United States,,8642303,Consumer Staples,Packaged Foods
KIDS,OrthoPediatrics Corp. Common Stock,$31.08 ,-0.85,-2.66%,740601653,United States,2017,107248,Health Care,Medical/Dental Instruments
KIM,Kimco Realty Corporation (HC) Common Stock,$19.28 ,-0.25,-1.28%,12996965156,United States,,4629651,Real Estate,Real Estate Investment Trusts
KIM^L,Kimco Realty Corporation Class L Depositary Shares each of which represents a one-one thousandth fractional interest in a share of 5.125% Class L Cumulative Redeemable Preferred Stock liquidation preference $25000.00 per share,$21.21 ,-0.17,-0.80%,,United States,,28923,,
KIM^M,Kimco Realty Corporation Class M Depositary Shares each of which represents a one-one thousandth fractional interest in a share of 5.25% Class M Cumulative Redeemable Preferred Stock liquidation preference $25000.00 per share,$21.80 ,0.01,0.05%,,United States,,20592,,
KIM^N,Kimco Realty Corporation Depositary Shares each representing 1/1000th interest in a share of 7.25% Class N Cumulative Convertible Perpetual Preferred Stock,$54.55 ,-0.04,-0.07%,,United States,,1638,,
KIND,Nextdoor Holdings Inc. Class A Common Stock,$2.39 ,-0.14,-5.53%,932773265,United States,,2618186,Technology,Computer Software: Programming Data Processing
KINS,Kingstone Companies Inc. Common Stock,$4.68 ,-0.16,-3.31%,51517608,United States,,27160,Finance,Property-Casualty Insurers
KIO,KKR Income Opportunities Fund Common Shares,$13.43 ,-0.02,-0.15%,0,,2013,135859,Finance,Investment Managers
KIRK,Kirkland's Inc. COMMONSTOCK,$2.24 ,-0.145,-6.09%,28889659,United States,2002,96784,Consumer Discretionary,Other Specialty Stores
KITT,Nauticus Robotics Inc. Common stock,$0.12 ,-0.0143,-11.05%,7185897,United States,2021,7060733,Industrials,Industrial Machinery/Components
KITTW,Nauticus Robotics Inc. Warrant,$0.02 ,-0.0013,-6.10%,1248635,United States,2021,5230,Industrials,Industrial Machinery/Components
KKR,KKR & Co. Inc. Common Stock,$101.31 ,-1.86,-1.80%,89902667645,United States,,3320460,Finance,Investment Managers
KKRS,KKR Group Finance Co. IX LLC 4.625% Subordinated Notes due 2061,$19.43 ,0.03,0.16%,17242215303,United States,2021,20735,,
KLAC,KLA Corporation Common Stock,$750.56 ,-3.59,-0.48%,1.01E+11,United States,1980,474401,Technology,Electronic Components
KLG,WK Kellogg Co Common Stock,$18.82 ,0.3,1.62%,1616215077,United States,2023,855796,Consumer Staples,Packaged Foods
KLIC,Kulicke and Soffa Industries Inc. Common Stock,$44.13 ,-0.82,-1.82%,2447612287,Singapore,,396473,Technology,Semiconductors
KLTR,Kaltura Inc. Common Stock,$0.99 ,-0.0255,-2.50%,146103173,United States,2021,127926,Technology,Computer Software: Prepackaged Software
KLXE,KLX Energy Services Holdings Inc. Common Stock,$4.71 ,-0.1,-2.08%,79444715,United States,,172900,Energy,Oilfield Services/Equipment
KMB,Kimberly-Clark Corporation Common Stock,$137.39 ,2.5,1.85%,46260460089,United States,,3553425,Consumer Discretionary,Containers/Packaging
KMDA,Kamada Ltd. Ordinary Shares,$5.23 ,-0.13,-2.43%,234513200,Israel,2013,4171,Health Care,Biotechnology: Pharmaceutical Preparations
KMI,Kinder Morgan Inc. Common Stock,$19.66 ,0.16,0.82%,43633098955,United States,2011,13989816,Utilities,Natural Gas Distribution
KMPB,Kemper Corporation 5.875% Fixed-Rate Reset Junior Subordinated Debentures due 2062,$22.61 ,0.01,0.04%,1455526709,United States,2022,7435,Finance,Property-Casualty Insurers
KMPR,Kemper Corporation,$58.28 ,-0.54,-0.92%,3751795515,United States,,221557,Finance,Property-Casualty Insurers
KMT,Kennametal Inc. Common Stock,$25.02 ,-0.42,-1.65%,1968221068,United States,,427335,Industrials,Industrial Machinery/Components
KMX,CarMax Inc,$70.98 ,0.45,0.64%,11171369009,United States,,1572314,Consumer Discretionary,Retail-Auto Dealers and Gas Stations
KN,Knowles Corporation Common Stock,$17.23 ,-0.32,-1.82%,1546295064,United States,2014,326681,Consumer Staples,Consumer Electronics/Appliances
KNDI,Kandi Technologies Group Inc. Ordinary Shares,$2.12 ,0.05,2.42%,185199456,China,,66350,Consumer Discretionary,Auto Manufacturing
KNF,Knife Riv Holding Co. Common Stock,$67.06 ,-1.97,-2.85%,3796246750,United States,2023,482551,Industrials,Mining & Quarrying of Nonmetallic Minerals (No Fuels)
KNOP,KNOT Offshore Partners LP Common Units representing Limited Partner Interests,$7.36 ,0.37,5.29%,250571796,United Kingdom,2013,327101,Consumer Discretionary,Marine Transportation
KNSA,Kiniksa Pharmaceuticals Ltd. Class A Common Stock,$19.32 ,-0.39,-1.98%,1370563601,United States,2018,280215,Health Care,Biotechnology: Pharmaceutical Preparations
KNSL,Kinsale Capital Group Inc. Common Stock,$380.61 ,-3.79,-0.99%,8859237836,United States,,101562,Finance,Property-Casualty Insurers
KNTK,Kinetik Holdings Inc. Class A Common Stock,$39.85 ,-0.19,-0.48%,6123274209,United States,2022,633468,Utilities,Natural Gas Distribution
KNW,Know Labs Inc. Common Stock,$0.66 ,0,0.00%,56438030,,2022,123558,Industrials,Industrial Machinery/Components
KNX,Knight-Swift Transportation Holdings Inc.,$47.55 ,-1.15,-2.36%,7684603050,United States,2017,1827241,Industrials,Trucking Freight/Courier Services
KO,Coca-Cola Company (The) Common Stock,$63.94 ,1.01,1.61%,2.75E+11,United States,,11891082,Consumer Staples,Beverages (Production/Distribution)
KOD,Kodiak Sciences Inc Common Stock,$2.97 ,-0.27,-8.33%,156028793,United States,2018,305525,Health Care,Biotechnology: Biological Products (No Diagnostic Substances)
KODK,Eastman Kodak Company Common New,$5.44 ,0.06,1.12%,435744000,United States,,792306,Consumer Discretionary,Industrial Machinery/Components
KOF,Coca Cola Femsa S.A.B. de C.V.  American Depositary Shares each representing 10 Units (each Unit consists of 3 Series B Shares and 5 Series L Shares),$90.27 ,1.97,2.23%,18964212811,Mexico,1993,270973,Consumer Staples,Beverages (Production/Distribution)
KOP,Koppers Holdings Inc. Common Stock,$43.22 ,-1.16,-2.61%,916271952,United States,2006,197703,Basic Materials,Forest Products
KOPN,Kopin Corporation Common Stock,$0.79 ,-0.0098,-1.22%,93806819,United States,1992,597217,Technology,Industrial Machinery/Components
KORE,KORE Group Holdings Inc. Common Stock,$0.61 ,-0.0518,-7.83%,50766713,United States,,20401,Telecommunications,Telecommunications Equipment
KOS,Kosmos Energy Ltd. Common Shares (DE),$5.74 ,-0.12,-2.05%,2706688436,Bermuda,2011,7559299,Energy,Oil & Gas Production
KOSS,Koss Corporation Common Stock,$4.65 ,-0.08,-1.69%,43034797,United States,,211847,Consumer Staples,Consumer Electronics/Appliances
KPLT,Katapult Holdings Inc. Common Stock,$15.32 ,-1.36,-8.15%,62898481,United States,2019,18350,Consumer Discretionary,Diversified Commercial Services
KPLTW,Katapult Holdings Inc. Warrant,$0.02 ,0.0004,2.25%,74723,United States,2019,8455,Consumer Discretionary,Diversified Commercial Services
KPRX,Kiora Pharmaceuticals Inc.  Common Stock,$0.48 ,-0.01,-2.03%,12655487,United States,,96783,Health Care,Biotechnology: In Vitro & In Vivo Diagnostic Substances
KPTI,Karyopharm Therapeutics Inc. Common Stock,$0.93 ,-0.0606,-6.14%,109117414,United States,2013,1078900,Miscellaneous,Diversified Commercial Services
KR,Kroger Company (The) Common Stock,$52.04 ,0.18,0.35%,37556635402,United States,,5679568,Consumer Staples,Food Chains
KRC,Kilroy Realty Corporation Common Stock,$33.45 ,-0.18,-0.54%,3925971642,United States,1997,655213,Real Estate,Real Estate Investment Trusts
KREF,KKR Real Estate Finance Trust Inc. Common Stock,$9.39 ,-0.12,-1.26%,650857145,United States,2017,345909,Real Estate,Real Estate Investment Trusts
KREF^A,KKR Real Estate Finance Trust Inc. 6.50% Series A Cumulative Redeemable Preferred Stock,$19.07 ,-0.04,-0.21%,,United States,,13658,,
KRG,Kite Realty Group Trust Common Stock,$22.02 ,-0.15,-0.68%,4835677041,United States,2004,1154245,Real Estate,Real Estate Investment Trusts
KRKR,36Kr Holdings Inc. American Depositary Shares,$0.40 ,0,0.00%,15602281,China,2019,1590,Consumer Discretionary,Business Services
KRMD,KORU Medical Systems Inc. Common Stock (DE),$2.11 ,-0.01,-0.47%,96562515,United States,,64508,Health Care,Medical/Dental Instruments
KRNL,Kernel Group Holdings Inc. Class A Ordinary Shares,$11.01 ,0.01,0.09%,0,United States,2021,1370,Finance,Blank Checks
KRNLW,Kernel Group Holdings Inc. Warrants,$0.12 ,0.0001,0.08%,0,United States,2021,132,Finance,Blank Checks
KRNT,Kornit Digital Ltd. Ordinary Shares,$13.92 ,-0.43,-3.00%,664257291,Israel,2015,181924,Industrials,Industrial Machinery/Components
KRNY,Kearny Financial Corp Common Stock,$5.40 ,-0.22,-3.92%,347959773,United States,2005,399421,Finance,Savings Institutions
KRO,Kronos Worldwide Inc Common Stock,$13.77 ,-0.17,-1.22%,1583922010,United States,,188762,Industrials,Major Chemicals
KRON,Kronos Bio Inc. Common Stock,$0.74 ,-0.006,-0.81%,44409768,United States,2020,392847,Health Care,Biotechnology: Pharmaceutical Preparations
KROS,Keros Therapeutics Inc. Common Stock,$49.53 ,0.86,1.77%,1787234874,United States,2020,273513,Health Care,Biotechnology: Pharmaceutical Preparations
KRP,Kimbell Royalty Partners Common Units Representing Limited Partner Interests,$16.34 ,-0.19,-1.15%,1560368218,United States,2017,497695,Energy,Oil & Gas Production
KRRO,Korro Bio Inc. Common Stock,$49.51 ,-0.97,-1.92%,459105586,United States,2019,40661,Health Care,Biotechnology: Pharmaceutical Preparations
KRT,Karat Packaging Inc. Common Stock,$28.11 ,-0.26,-0.92%,561498150,United States,2021,35554,Industrials,Plastic Products
KRUS,Kura Sushi USA Inc. Class A Common Stock,$97.30 ,0.27,0.28%,1092748375,United States,2019,66297,Consumer Discretionary,Restaurants
KRYS,Krystal Biotech Inc. Common Stock,$161.09 ,-3.17,-1.93%,4600479100,United States,2017,152107,Health Care,Biotechnology: Biological Products (No Diagnostic Substances)
KSCP,Knightscope Inc. Class A Common Stock,$0.29 ,-0.0179,-5.88%,30676594,United States,2022,811191,Telecommunications,Telecommunications Equipment
KSM,DWS Strategic Municipal Income Trust,$9.58 ,0.055,0.58%,0,United States,1989,24236,Finance,Trusts Except Educational Religious and Charitable
KSPI,Joint Stock Company Kaspi.kz American Depository Shares,$124.98 ,-3.36,-2.62%,23662896456,Kazakhstan,2024,359375,,
KSS,Kohl's Corporation Common Stock,$22.47 ,-1.38,-5.79%,2492075279,United States,1992,6954534,Consumer Discretionary,Department/Specialty Retail Stores
KT,KT Corporation Common Stock,$13.39 ,-0.2,-1.47%,6598951441,South Korea,,674526,Telecommunications,Telecommunications Equipment
KTB,Kontoor Brands Inc. Common Stock ,$73.15 ,-0.34,-0.46%,4083941019,United States,2019,379923,Consumer Discretionary,Apparel
KTCC,Key Tronic Corporation Common Stock,$4.01 ,-0.08,-1.96%,43155103,United States,1983,20594,Technology,Electrical Products
KTF,DWS Municipal Income Trust,$9.39 ,0.07,0.75%,370913808,United States,1988,67415,Finance,Finance Companies
KTH,Structures Products Cp 8% CorTS Issued by Peco Energy Cap Tr II Preferred Stock,$28.15 ,-0.05,-0.18%,0,United States,,3555,Finance,Finance: Consumer Services
KTN,Structured Products Corp 8.205% CorTS 8.205% Corporate Backed Trust Securities (CorTS),$27.32 ,0,0.00%,0,United States,,5,Finance,Finance: Consumer Services
KTOS,Kratos Defense & Security Solutions Inc. Common Stock,$21.10 ,-0.67,-3.08%,3167071682,United States,,963124,Industrials,Military/Government/Technical
KTRA,Kintara Therapeutics Inc. Common Stock,$0.22 ,-0.0481,-17.74%,12332929,United States,,10186483,Health Care,Biotechnology: Pharmaceutical Preparations
KTTA,Pasithea Therapeutics Corp. Common Stock,$5.60 ,-0.1054,-1.85%,5846988,United States,2021,467,Health Care,Biotechnology: Pharmaceutical Preparations
KTTAW,Pasithea Therapeutics Corp. Warrant,$0.02 ,0,0.00%,18778,United States,2021,50,Health Care,Biotechnology: Pharmaceutical Preparations
KUKE,Kuke Music Holding Limited American Depositary Shares each representing one Ordinary Share,$2.85 ,-0.1,-3.39%,94767411,,2021,13276,Real Estate,Other Consumer Services
KULR,KULR Technology Group Inc. Common Stock,$0.31 ,-0.0121,-3.76%,56629939,United States,,1413266,Technology,Electrical Products
KURA,Kura Oncology Inc. Common Stock,$20.79 ,-0.4,-1.89%,1583795090,United States,,588469,Health Care,Biotechnology: Pharmaceutical Preparations
KVAC,Keen Vision Acquisition Corporation Ordinary Shares,$10.56 ,0.0001,0.00%,0,United States,2023,48933,,
KVACU,Keen Vision Acquisition Corporation Units,$10.58 ,-0.22,-2.04%,0,United States,2023,513,,
KVACW,Keen Vision Acquisition Corporation Warrant,$0.05 ,0,0.00%,0,United States,2023,7,,
KVHI,KVH Industries Inc. Common Stock,$5.10 ,-0.01,-0.20%,100552727,United States,1996,55044,Technology,Radio And Television Broadcasting And Communications Equipment
KVUE,Kenvue Inc. Common Stock,$19.15 ,-0.09,-0.47%,36668626743,United States,2023,18523465,Consumer Discretionary,Specialty Chemicals
KVYO,Klaviyo Inc. Series A Common Stock,$22.08 ,-0.28,-1.25%,5841475548,United States,2023,685016,Technology,Computer Software: Prepackaged Software
KW,Kennedy-Wilson Holdings Inc. Common Stock,$10.34 ,0.14,1.37%,1422040957,United States,,654271,Finance,Real Estate
KWE,KWESST Micro Systems Inc. Common Stock,$0.41 ,-0.0255,-5.88%,2771347,Canada,,122424,,
KWESW,KWESST Micro Systems Inc. Warrant,$0.07 ,-0.0006,-0.86%,1190810,Canada,,400,Technology,Computer Software: Prepackaged Software
KWR,Quaker Houghton Common Stock,$177.00 ,-1.72,-0.96%,3184210884,United States,,66223,Industrials,Major Chemicals
KXIN,Kaixin Holdings Ordinary Shares,$0.15 ,-0.009,-5.77%,7316583,China,2017,1401820,Consumer Discretionary,Retail-Auto Dealers and Gas Stations
KYMR,Kymera Therapeutics Inc. Common Stock,$31.94 ,0.38,1.20%,1959782888,United States,2020,534572,Health Care,Biotechnology: Biological Products (No Diagnostic Substances)
KYN,Kayne Anderson Energy Infrastructure Fund Inc.,$9.86 ,0.11,1.13%,1342256886,United States,2004,507921,Finance,Finance/Investors Services
KYTX,Kyverna Therapeutics Inc. Common Stock,$12.97 ,-0.1,-0.77%,559204715,United States,2024,1071768,Health Care,Biotechnology: Biological Products (No Diagnostic Substances)
KZIA,Kazia Therapeutics Limited American Depositary Shares,$0.25 ,-0.0197,-7.30%,5705288,Australia,,80414,Health Care,Biotechnology: Pharmaceutical Preparations
KZR,Kezar Life Sciences Inc. Common Stock,$0.70 ,-0.0067,-0.95%,51106554,United States,2018,189236,Health Care,Biotechnology: Pharmaceutical Preparations
L,Loews Corporation Common Stock,$75.55 ,-0.32,-0.42%,16727242867,United States,,1274902,Finance,Property-Casualty Insurers
LAAC,Lithium Americas (Argentina) Corp. Common Shares,$4.26 ,-0.25,-5.54%,681250680,Canada,2023,733143,,
LAB,Standard BioTools Inc. Common Stock,$2.53 ,0.05,2.02%,941518071,United States,2011,2586444,Industrials,Biotechnology: Laboratory Analytical Instruments
LAC,Lithium Americas Corp. Common Shares,$3.18 ,-0.11,-3.34%,511344000,Canada,2023,4321444,Basic Materials,Metal Mining
LAD,Lithia Motors Inc. Common Stock,$265.52 ,-4.01,-1.49%,7276970163,United States,,400922,Consumer Discretionary,Retail-Auto Dealers and Gas Stations
LADR,Ladder Capital Corp Class A Common Stock,$11.00 ,-0.24,-2.14%,1406772125,United States,2014,535724,Real Estate,Real Estate Investment Trusts
LAES,SEALSQ Corp Ordinary Shares,$1.09 ,-0.04,-3.54%,16837020,Switzerland,,209999,Technology,Semiconductors
LAKE,Lakeland Industries Inc. Common Stock,$18.85 ,-0.09,-0.48%,138957111,United States,1986,88694,Health Care,Industrial Specialties
LAMR,Lamar Advertising Company Class A Common Stock,$117.09 ,-0.04,-0.03%,11971362860,United States,1996,268188,Real Estate,Real Estate Investment Trusts
LANC,Lancaster Colony Corporation Common Stock,$185.30 ,-0.11,-0.06%,5100753100,United States,,111782,Consumer Staples,Packaged Foods
LAND,Gladstone Land Corporation Common Stock,$13.49 ,0.04,0.30%,483460583,United States,2013,110358,Real Estate,Real Estate Investment Trusts
LANDM,Gladstone Land Corporation 5.00% Series D Cumulative Term Preferred Stock,$24.25 ,0.08,0.33%,869082219,United States,,2878,Real Estate,Real Estate Investment Trusts
LANDO,Gladstone Land Corporation 6.00% Series B Cumulative Redeemable Preferred Stock,$20.51 ,0.2601,1.28%,735046445,United States,,14219,Real Estate,Real Estate Investment Trusts
LANDP,Gladstone Land Corporation 6.00% Series C Cumulative Redeemable Preferred Stock,$20.33 ,0.0802,0.40%,728595526,United States,,15420,Real Estate,Real Estate Investment Trusts
