Symbol,Name,Last Sale,Net Change,% Change,Market Cap,Country,IPO Year,Volume,Sector,Industry
PRTH,Priority Technology Holdings Inc. Common Stock,$4.20 ,-0.42,-9.09%,336273609,United States,2016,54429,Technology,EDP Services
PRTS,CarParts.com Inc. Common Stock,$1.06 ,-0.08,-7.02%,60099786,United States,2007,983883,Consumer Discretionary,Auto & Home Supply Stores
PRU,Prudential Financial Inc. Common Stock,$117.98 ,-1.64,-1.37%,42354820000,United States,2001,1467513,Finance,Life Insurance
PRVA,Privia Health Group Inc. Common Stock,$17.46 ,0.13,0.75%,2083288893,United States,2021,966074,Health Care,Medical/Nursing Services
PRZO,ParaZero Technologies Ltd. Ordinary Shares,$0.66 ,-0.0152,-2.25%,6646796,Israel,2023,101541,Industrials,Military/Government/Technical
PSA,Public Storage Common Stock,$278.97 ,4.58,1.67%,49021909795,United States,,608746,Real Estate,Real Estate Investment Trusts
PSA^F,Public Storage Depositary Shares Each Representing 1/1000 of a 5.15% Cumulative Preferred Share of Beneficial Interest Series F par value $0.01 per share,$23.66 ,0.1,0.42%,,United States,,8530,,
PSA^G,Public Storage Depositary Shares Each Representing 1/1000 of a 5.05% Cumulative Preferred Share of Beneficial Interest Series G,$23.65 ,0.02,0.09%,,United States,,5503,,
PSA^H,Public Storage Depositary Shares Each Representing 1/1000 of a  5.60% Cumulative Preferred  Share of Beneficial Interest Series H,$25.39 ,0.07,0.28%,,United States,,23317,,
PSA^I,Public Storage Depositary Shares Each Representing 1/1000 of a 4.875% Cumulative Preferred Share of Beneficial Interest Series I par value $0.01 per share,$22.47 ,0.01,0.05%,,United States,,18453,,
PSA^J,Public Storage Depositary Shares Each Representing 1/1000 of a 4.700% Cumulative Preferred Share of Beneficial Interest Series J par value $0.01 per share,$21.22 ,0.14,0.66%,,United States,,13025,,
PSA^K,Public Storage Depositary Shares Each Representing 1/1000 of a 4.75% Cumulative Preferred Share of Beneficial Interest Series K,$21.58 ,0.25,1.17%,,United States,,18095,,
PSA^L,Public Storage Depositary Shares Each Representing 1/1000 of a 4.625% Cumulative Preferred Share of Beneficial Interest Series L par value $0.01 per share,$20.85 ,0.1,0.48%,,United States,,24639,,
PSA^M,Public Storage Depositary Shares Each Representing 1/1000 of a 4.125% Cumulative Preferred Share of Beneficial Interest Series M,$18.89 ,0.17,0.91%,,United States,,12037,,
PSA^N,Public Storage Depositary Shares Each Representing 1/1000 of a 3.875% Cumulative Preferred Share of Beneficial Interest Series N,$17.57 ,0.08,0.46%,,United States,,5640,,
PSA^O,Public Storage Depositary Shares Each Representing 1/1000 of a 3.900% Cumulative Preferred Share of Beneficial Interest Series O,$17.69 ,0.14,0.80%,,United States,,13519,,
PSA^P,Public Storage Depositary Shares Each Representing 1/1000 of a 4.000% Cumulative Preferred Share of Bene cial Interest Series P,$18.27 ,0.08,0.44%,,United States,,20418,,
PSA^Q,Public Storage Depositary Shares Each Representing 1/1000 of a 3.950% Cumulative Preferred Share of Beneficial Interest Series Q par value $0.01 per share,$17.90 ,0.13,0.73%,,United States,,16494,,
PSA^R,Public Storage Depositary Shares Each Representing 1/1000 of a 4.00% Cumulative Preferred Share of Bene cial Interest Series R,$18.50 ,0.18,0.98%,,United States,,30267,,
PSA^S,Public Storage Depositary Shares Each Representing 1/1000 of a 4.100% Cumulative Preferred Share of Beneficial Interest Series S,$18.58 ,0.16,0.87%,,United States,,21708,,
PSBD,Palmer Square Capital BDC Inc. Common Stock,$16.45 ,0.13,0.80%,0,,2024,18128,,
PSEC,Prospect Capital Corporation Common Stock,$5.66 ,0.05,0.89%,2364508520,United States,2004,1302513,Finance,Finance: Consumer Services
PSEC^A,Prospect Capital Corporation 5.35% Series A Fixed Rate Cumulative Perpetual Preferred Stock,$16.90 ,0.07,0.42%,,United States,,11032,,
PSF,Cohen & Steers Select Preferred and Income Fund Inc. Common Stock,$19.61 ,0.06,0.31%,963608495,,2010,9355,Finance,Investment Managers
PSFE,Paysafe Limited Common Shares,$17.80 ,-0.28,-1.55%,1098606085,,2021,342954,Consumer Discretionary,Business Services
PSHG,Performance Shipping Inc. Common Shares,$2.23 ,-0.16,-6.70%,27383677,Greece,,141881,Consumer Discretionary,Marine Transportation
PSMT,PriceSmart Inc. Common Stock,$83.00 ,-0.9,-1.07%,2544360684,United States,,76714,Consumer Discretionary,Department/Specialty Retail Stores
PSN,Parsons Corporation Common Stock,$74.28 ,-0.55,-0.74%,10900422499,United States,2019,706077,Technology,EDP Services
PSNL,Personalis Inc. Common Stock,$1.35 ,-0.1,-6.90%,70117433,United States,2019,187409,Health Care,Medical Specialities
PSNY,Polestar Automotive Holding UK PLC Class A ADS,$0.75 ,-0.0586,-7.23%,1586254396,Sweden,,7865882,Consumer Discretionary,Auto Manufacturing
PSNYW,Polestar Automotive Holding UK PLC Class C-1 ADS (ADW),$0.14 ,-0.0135,-9.00%,288007083,Sweden,,45517,Consumer Discretionary,Auto Manufacturing
PSO,Pearson Plc Common Stock,$11.99 ,0.08,0.67%,8232214759,United Kingdom,,575310,Consumer Discretionary,Books
PSQH,PSQ Holdings Inc. Class A Common Stock,$3.23 ,-0.15,-4.44%,101394852,,2021,135316,Consumer Discretionary,Advertising
PSTG,Pure Storage Inc. Class A Common Stock,$60.44 ,0.64,1.07%,19637579016,United States,2015,2679948,Technology,Electronic Components
PSTL,Postal Realty Trust Inc. Class A Common Stock,$13.48 ,0.04,0.30%,305523229,United States,2019,126619,Real Estate,Real Estate Investment Trusts
PSTV,PLUS THERAPEUTICS Inc. Common Stock ,$2.60 ,0.35,15.56%,14830969,United States,,142995,Health Care,Medical/Dental Instruments
PSTX,Poseida Therapeutics Inc. Common Stock,$2.65 ,-0.41,-13.40%,256937773,United States,2020,491097,Health Care,Biotechnology: Biological Products (No Diagnostic Substances)
PSX,Phillips 66 Common Stock,$136.99 ,-1.94,-1.40%,58077202974,United States,,3146791,Energy,Integrated oil Companies
PT,Pintec Technology Holdings Limited American Depositary Shares,$1.06 ,-0.04,-3.64%,16904839,China,2018,80048,Technology,Computer Software: Programming Data Processing
PTA,Cohen & Steers Tax-Advantaged Preferred Securities and Income Fund Common Shares of Beneficial Interest,$19.38 ,-0.02,-0.10%,1071199597,United States,2020,146597,Finance,Trusts Except Educational Religious and Charitable
PTC,PTC Inc. Common Stock,$171.47 ,-2.64,-1.52%,20532548262,United States,,1287608,Technology,Computer Software: Prepackaged Software
PTCT,PTC Therapeutics Inc. Common Stock,$37.91 ,0.48,1.28%,2907575119,United States,2013,550286,Health Care,Biotechnology: Pharmaceutical Preparations
PTEN,Patterson-UTI Energy Inc. Common Stock,$10.18 ,-0.22,-2.12%,4089320130,United States,1993,7611233,Energy,Oil & Gas Production
PTGX,Protagonist Therapeutics Inc. Common Stock,$29.31 ,-0.5,-1.68%,1719094018,United States,2016,390119,Health Care,Biotechnology: Pharmaceutical Preparations
PTIX,Protagenic Therapeutics Inc. Common Stock,$1.22 ,-0.14,-10.29%,5410861,United States,,1757,Health Care,Biotechnology: Pharmaceutical Preparations
PTIXW,Protagenic Therapeutics Inc. Warrant,$0.01 ,-0.0001,-1.00%,43908,United States,,87096,Health Care,Biotechnology: Pharmaceutical Preparations
PTLO,Portillo's Inc. Class A Common Stock,$10.01 ,-0.08,-0.79%,616737081,United States,2021,1007353,Consumer Discretionary,Restaurants
PTMN,Portman Ridge Finance Corporation Common Stock,$19.57 ,0.26,1.35%,182120866,United States,2006,30137,Finance,Finance/Investors Services
PTN,Palatin Technologies Inc. Common Stock,$1.83 ,-0.05,-2.66%,29530051,United States,1999,70076,Health Care,Biotechnology: Pharmaceutical Preparations
PTON,Peloton Interactive Inc. Class A Common Stock,$3.62 ,-0.03,-0.82%,1342347983,United States,2019,8686969,Consumer Discretionary,Recreational Games/Products/Toys
PTPI,Petros Pharmaceuticals Inc. Common Stock,$0.51 ,-0.0118,-2.27%,3550499,United States,,456567,Health Care,Biotechnology: Pharmaceutical Preparations
PTSI,P.A.M. Transportation Services Inc. Common Stock,$15.91 ,-0.09,-0.56%,350573063,United States,1986,8169,Industrials,Trucking Freight/Courier Services
PTVE,Pactiv Evergreen Inc. Common stock,$11.97 ,-0.33,-2.68%,2144419072,United States,2020,260410,Consumer Discretionary,Containers/Packaging
PTWO,Pono Capital Two Inc. Class A Common Stock,$15.08 ,1.205,8.69%,0,United States,2022,90056,Finance,Blank Checks
PTWOU,Pono Capital Two Inc. Unit,$15.00 ,-2,-11.77%,0,United States,2022,2152,Finance,Blank Checks
PTWOW,Pono Capital Two Inc. Warrants,$0.07 ,0.0023,3.25%,0,United States,2022,3592,Finance,Blank Checks
PTY,Pimco Corporate & Income Opportunity Fund,$14.48 ,0.02,0.14%,0,United States,2002,394289,Finance,Investment Managers
PUBM,PubMatic Inc. Class A Common Stock,$21.10 ,0.02,0.10%,1053544332,United States,2020,447978,Technology,Computer Software: Programming Data Processing
PUK,Prudential Public Limited Company Common Stock,$19.37 ,-0.25,-1.27%,26667848522,United Kingdom,,593653,Finance,Life Insurance
PULM,Pulmatrix Inc. Common Stock,$1.93 ,-0.03,-1.53%,7048910,United States,2014,7952,Health Care,Biotechnology: Pharmaceutical Preparations
PUMP,ProPetro Holding Corp. Common Stock,$8.84 ,-0.36,-3.91%,946226077,United States,2017,1223187,Energy,Oilfield Services/Equipment
PVBC,Provident Bancorp Inc. (MD) Common Stock,$9.99 ,0.35,3.63%,176387556,United States,2015,134289,Finance,Major Banks
PVH,PVH Corp. Common Stock,$119.25 ,-3.23,-2.64%,6879402279,United States,,1267846,Consumer Discretionary,Apparel
PVL,Permianville Royalty Trust Trust Units ,$1.25 ,-0.09,-6.72%,41250000,United States,2011,146566,Energy,Oil & Gas Production
PW,Power REIT (MD) Common Stock,$1.12 ,0.1225,12.25%,3804894,United States,1998,456838,Real Estate,Real Estate Investment Trusts
PW^A,Power REIT 7.75% Series A Cumulative Perpetual Preferred Stock,$3.05 ,-0.3511,-10.32%,,United States,,705,,
PWFL,PowerFleet Inc. Common Stock,$4.77 ,-0.465,-8.88%,512059438,United States,,734292,Telecommunications,Telecommunications Equipment
PWM,Prestige Wealth Inc. Class A Ordinary Shares,$1.00 ,-0.07,-6.54%,9150000,Hong Kong,2023,130137,Finance,Finance: Consumer Services
PWOD,Penns Woods Bancorp Inc. Common Stock,$20.11 ,0,0.00%,151419230,United States,,24102,Finance,Major Banks
PWP,Perella Weinberg Partners Class A Common Stock,$14.75 ,-0.47,-3.09%,1389540580,United States,2020,620885,Finance,Finance: Consumer Services
PWR,Quanta Services Inc. Common Stock,$270.02 ,-1.95,-0.72%,39527810619,United States,,1258817,Industrials,Engineering & Construction
PWSC,PowerSchool Holdings Inc. Class A Common Stock,$22.22 ,0.88,4.12%,4525153706,United States,2021,3484877,Technology,Computer Software: Prepackaged Software
PWUP,PowerUp Acquisition Corp. Class A Ordinary Shares,$11.37 ,0,0.00%,0,United States,2022,2145,Finance,Blank Checks
PWUPU,PowerUp Acquisition Corp. Unit,$12.00 ,0,0.00%,0,United States,2022,1,Finance,Blank Checks
PWUPW,PowerUp Acquisition Corp. Warrant,$0.03 ,0.0025,8.33%,0,United States,2022,267333,Finance,Blank Checks
PX,P10 Inc. Class A Common Stock,$7.96 ,-0.07,-0.87%,899659856,United States,2021,337277,Finance,Investment Managers
PXDT,Pixie Dust Technologies Inc. American Depositary Shares ,$2.39 ,-0.0201,-0.83%,35136948,Japan,2023,5427,Health Care,Biotechnology: Electromedical & Electrotherapeutic Apparatus
PXLW,Pixelworks Inc.  Common Stock,$1.00 ,-0.04,-3.85%,57807303,United States,2000,641085,Technology,Semiconductors
PXS,Pyxis Tankers Inc. Common Stock,$5.10 ,-0.01,-0.20%,53766990,Greece,,11117,Consumer Discretionary,Marine Transportation
PXSAP,Pyxis Tankers Inc. 7.75% Series A Cumulative Convertible Preferred Shares,$24.98 ,0.0785,0.32%,263351770,Greece,,3081,Consumer Discretionary,Marine Transportation
PXSAW,Pyxis Tankers Inc. Warrant,$1.03 ,0.03,3.00%,10858823,Greece,,6100,Consumer Discretionary,Marine Transportation
PYCR,Paycor HCM Inc. Common Stock,$11.94 ,-0.16,-1.32%,2127828976,United States,2021,610738,Technology,Computer Software: Prepackaged Software
PYN,PIMCO New York Municipal Income Fund III Common Shares of Beneficial Interest,$5.84 ,0.04,0.69%,0,United States,2002,7663,Finance,Investment Managers
PYPD,PolyPid Ltd. Ordinary Shares,$4.05 ,-0.1,-2.41%,6696914,Israel,2020,1362,Health Care,Medical/Dental Instruments
PYPL,PayPal Holdings Inc. Common Stock,$63.33 ,-0.13,-0.21%,66246095777,United States,,9037476,Consumer Discretionary,Business Services
PYT,PPlus Tr GSC-2 Tr Ctf Fltg Rate,$22.65 ,-0.2863,-1.25%,0,United States,,400,Finance,Finance: Consumer Services
PYXS,Pyxis Oncology Inc. Common Stock,$3.65 ,-0.11,-2.93%,214942926,United States,2021,324439,Health Care,Biotechnology: Pharmaceutical Preparations
PZC,PIMCO California Municipal Income Fund III Common Shares of Beneficial Interest,$7.02 ,0.02,0.29%,0,United States,2002,80866,Finance,Investment Managers
PZG,Paramount Gold Nevada Corp. Common Stock,$0.47 ,-0.0373,-7.31%,30077150,United States,2015,240562,Basic Materials,Metal Mining
PZZA,Papa John's International Inc. Common Stock,$47.95 ,-0.29,-0.60%,1581022984,United States,1993,852845,Consumer Discretionary,Restaurants
QBTS,D-Wave Quantum Inc. Common Shares,$1.29 ,-0.03,-2.27%,220938260,,2022,2520386,Technology,EDP Services
QCOM,QUALCOMM Incorporated Common Stock,$204.37 ,-1.54,-0.75%,2.28E+11,United States,1991,6622802,Technology,Radio And Television Broadcasting And Communications Equipment
QCRH,QCR Holdings Inc. Common Stock,$55.64 ,-0.55,-0.98%,935101364,United States,,39344,Finance,Major Banks
QD,Qudian Inc. American Depositary Shares each representing one Class A Ordinary Share,$1.69 ,0.01,0.60%,320092508,China,2017,313887,Finance,Finance: Consumer Services
QDEL,QuidelOrtho Corporation Common Stock,$43.26 ,-1.7,-3.78%,2897200760,United States,,568328,Health Care,Biotechnology: In Vitro & In Vivo Diagnostic Substances
QETA,Quetta Acquisition Corporation Common Stock,$10.31 ,-0.02,-0.19%,0,United States,2023,3998,,
QETAR,Quetta Acquisition Corporation Right,$1.23 ,0,0.00%,0,United States,2023,4,,
QETAU,Quetta Acquisition Corporation Unit,$10.35 ,0,0.00%,0,United States,2023,151,,
QFIN,Qifu Technology Inc. American Depositary Shares,$19.15 ,-0.25,-1.29%,2973123196,China,2018,727106,Finance,Finance: Consumer Services
QGEN,Qiagen N.V. Common Shares,$43.67 ,-0.33,-0.75%,9965614311,Netherlands,,634019,Health Care,Biotechnology: Biological Products (No Diagnostic Substances)
QH,Quhuo Limited American Depository Shares,$0.52 ,-0.0249,-4.57%,3207780,China,2020,243615,Consumer Discretionary,Business Services
QIPT,Quipt Home Medical Corp. Common Shares,$3.37 ,0.005,0.15%,141885327,United States,,95664,,
QLGN,Qualigen Therapeutics Inc. Common Stock,$0.27 ,-0.0099,-3.54%,1702990,United States,2015,345139,Health Care,Biotechnology: Pharmaceutical Preparations
QLI,Qilian International Holding Group Ltd. Ordinary Shares,$0.80 ,-0.0562,-6.53%,28739425,China,2021,13318,Health Care,Biotechnology: Pharmaceutical Preparations
QLYS,Qualys Inc. Common Stock,$133.57 ,-2.1,-1.55%,4933977225,United States,2012,455281,Technology,Computer Software: Prepackaged Software
QMCO,Quantum Corporation Common Stock,$0.47 ,-0.0147,-3.04%,44640574,United States,,43485,Technology,Electronic Components
QNCX,Quince Therapeutics Inc. Common Stock,$0.85 ,-0.0251,-2.86%,36815057,United States,2019,103346,Health Care,Biotechnology: Biological Products (No Diagnostic Substances)
QNRX,Quoin Pharmaceuticals Ltd. American Depositary Shares,$0.72 ,-0.0293,-3.91%,2868364,Israel,2016,16908,Health Care,Medical/Dental Instruments
QNST,QuinStreet Inc. Common Stock,$17.12 ,0.07,0.41%,946338867,United States,2010,236747,Consumer Discretionary,Business Services
QOMO,Qomolangma Acquisition Corp. Common Stock,$11.10 ,0,0.00%,0,United States,2022,3,Finance,Blank Checks
QQQX,Nuveen NASDAQ 100 Dynamic Overwrite Fund Shares of Beneficial Interest,$24.20 ,0.14,0.58%,0,United States,,92785,Finance,Finance Companies
QRHC,Quest Resource Holding Corporation Common Stock,$8.81 ,0.1,1.15%,178224723,United States,,27467,Utilities,Environmental Services
QRTEA,Qurate Retail Inc. Series A Common Stock ,$0.73 ,-0.0046,-0.63%,288675269,United States,,3779064,Consumer Discretionary,Catalog/Specialty Distribution
QRTEB,Qurate Retail Inc. Series B Common Stock ,$4.09 ,0.16,4.07%,1623153494,United States,,1289,Consumer Discretionary,Catalog/Specialty Distribution
QRTEP,Qurate Retail Inc. 8.0% Fixed Rate Cumulative Redeemable Preferred Stock,$47.55 ,-1.24,-2.54%,18870647590,United States,,81817,Consumer Discretionary,Catalog/Specialty Distribution
QRVO,Qorvo Inc. Common Stock,$97.70 ,-0.19,-0.19%,9342962582,United States,,1092520,Technology,Semiconductors
QS,QuantumScape Corporation Class A Common Stock,$5.64 ,-0.14,-2.42%,2817361907,United States,2020,2932364,Miscellaneous,Industrial Machinery/Components
QSG,QuantaSing Group Limited American Depositary Shares,$2.60 ,-0.1,-3.70%,143535995,China,2023,29676,Real Estate,Other Consumer Services
QSI,Quantum-Si Incorporated Class A Common Stock,$1.51 ,0.01,0.67%,214142898,United States,2020,317159,Industrials,Industrial Machinery/Components
QSIAW,Quantum-Si Incorporated Warrant,$0.18 ,-0.0081,-4.31%,25526968,United States,2020,2609,Industrials,Industrial Machinery/Components
QSR,Restaurant Brands International Inc. Common Shares,$69.99 ,-0.09,-0.13%,22143606906,Canada,2014,1484343,Consumer Discretionary,Restaurants
QTI,QT Imaging Holdings Inc. Common Stock,$0.70 ,-0.0002,-0.03%,15000415,United States,,102479,Health Care,Biotechnology: Electromedical & Electrotherapeutic Apparatus
QTRX,Quanterix Corporation Common Stock,$15.47 ,-0.04,-0.26%,592038261,United States,2017,320807,Industrials,Biotechnology: Laboratory Analytical Instruments
QTTB,Q32 Bio Inc. Common Stock,$26.20 ,-1.59,-5.72%,312883780,United States,2018,71590,Health Care,Biotechnology: Pharmaceutical Preparations
QTWO,Q2 Holdings Inc. Common Stock,$60.14 ,-0.5,-0.83%,3614384652,United States,2014,361609,Technology,Computer Software: Prepackaged Software
QUAD,Quad Graphics Inc Class A Common Stock,$5.00 ,0.07,1.42%,259691050,United States,,88491,Consumer Discretionary,Publishing
QUBT,Quantum Computing Inc. Common Stock,$0.70 ,-0.0049,-0.70%,63621460,United States,,711126,Technology,Computer Manufacturing
QUIK,QuickLogic Corporation Common Stock,$12.33 ,-0.6,-4.64%,177848204,United States,1999,197510,Technology,Semiconductors
QURE,uniQure N.V. Ordinary Shares,$5.42 ,0.09,1.69%,263137949,Netherlands,2014,1019703,Health Care,Biotechnology: Pharmaceutical Preparations
QVCC,QVC Inc. 6.250% Senior Secured Notes due 2068,$12.94 ,-0.28,-2.12%,13,United States,2019,18651,Consumer Discretionary,Catalog/Specialty Distribution
QVCD,QVC Inc. 6.375% Senior Secured Notes due 2067,$13.21 ,-0.27,-2.00%,13,United States,2018,23415,Consumer Discretionary,Catalog/Specialty Distribution
R,Ryder System Inc. Common Stock,$119.00 ,-1.96,-1.62%,5215626367,United States,,177842,Consumer Discretionary,Rental/Leasing Companies
RA,Brookfield Real Assets Income Fund Inc. Common Stock,$12.70 ,-0.08,-0.63%,0,United States,2016,268334,Finance,Investment Managers
RACE,Ferrari N.V. Common Shares,$410.74 ,1.69,0.41%,74104926287,Italy,2015,195092,Consumer Discretionary,Auto Manufacturing
RAIL,FreightCar America Inc. Common Stock,$3.51 ,-0.14,-3.84%,65674157,United States,2005,19301,Industrials,Railroads
RAMP,LiveRamp Holdings Inc. Common Stock,$31.31 ,0.15,0.48%,2071277357,United States,2018,465259,Technology,EDP Services
RAND,Rand Capital Corporation Common Stock,$17.41 ,-0.575,-3.20%,44922671,United States,,1812,Finance,Finance: Consumer Services
RANI,Rani Therapeutics Holdings Inc. Class A Common Stock,$4.67 ,-0.01,-0.21%,235462871,United States,2021,61831,Health Care,Biotechnology: Pharmaceutical Preparations
RAPT,RAPT Therapeutics Inc. Common Stock,$3.94 ,-0.04,-1.01%,137519695,United States,2019,486912,Health Care,Biotechnology: Pharmaceutical Preparations
RARE,Ultragenyx Pharmaceutical Inc. Common Stock,$40.92 ,-0.21,-0.51%,3401816314,United States,2014,645976,Health Care,Biotechnology: Pharmaceutical Preparations
RAVE,Rave Restaurant Group Inc. Common Stock,$1.89 ,-0.02,-1.05%,27568610,United States,,32295,Consumer Discretionary,Food Distributors
RAY,Raytech Holding Limited Ordinary Shares,$3.65 ,-0.0211,-0.57%,63943250,Hong Kong,2024,43097,Consumer Discretionary,Consumer Electronics/Appliances
RAYA,Erayak Power Solution Group Inc. Class A Ordinary Shares,$0.81 ,-0.0601,-6.91%,10084500,China,2022,14788,Consumer Discretionary,Metal Fabrications
RBA,RB Global Inc. Common Stock,$72.40 ,1.21,1.70%,13250414148,Canada,,796859,Consumer Discretionary,Business Services
RBB,RBB Bancorp Common Stock,$17.56 ,-0.51,-2.82%,323811211,United States,2017,52589,Finance,Major Banks
RBBN,Ribbon Communications Inc. Common Stock,$2.96 ,-0.1,-3.27%,514773266,United States,,250509,Technology,EDP Services
RBC,RBC Bearings Incorporated Common Stock,$285.62 ,-5.92,-2.03%,8343420619,United States,2022,255311,Industrials,Metal Fabrications
RBCAA,Republic Bancorp Inc. Class A Common Stock,$49.60 ,-1.2,-2.36%,962845814,United States,1998,12319,Finance,Major Banks
RBCP,RBC Bearings Incorporated 5.00% Series A Mandatory Convertible Preferred Stock,$130.05 ,0,0.00%,3798970141,United States,2022,527,Industrials,Metal Fabrications
RBKB,Rhinebeck Bancorp Inc. Common Stock,$7.98 ,-0.0556,-0.69%,88408123,United States,2019,411,Finance,Major Banks
RBLX,Roblox Corporation Class A Common Stock,$35.00 ,0.52,1.51%,22400000000,United States,2021,6445999,Technology,Computer Software: Prepackaged Software
RBOT,Vicarious Surgical Inc. Class A Common Stock,$0.32 ,-0.0018,-0.55%,47550626,Hong Kong,2020,204260,Health Care,Industrial Specialties
RBRK,Rubrik Inc. Class A Common Stock,$30.75 ,-0.06,-0.20%,5409915519,,2024,606908,Technology,Computer Software: Prepackaged Software
RBT,Rubicon Technologies Inc. Class A Common Stock,$0.20 ,-0.0163,-7.50%,11223215,,2022,835750,Technology,Semiconductors
RC,Ready Capital Corproation Common Stock,$8.40 ,-0.03,-0.36%,1418537459,United States,2013,1007993,Real Estate,Real Estate Investment Trusts
RC^C,Ready Capital Corporation 6.25% Series C Cumulative Convertible Preferred Stock,$18.08 ,0.06,0.33%,,United States,,600,,
RC^E,Ready Capital Corporation 6.50% Series E Cumulative Redeemable Preferred Stock,$18.76 ,0.09,0.48%,,United States,,7168,,
RCAT,Red Cat Holdings Inc. Common Stock,$0.95 ,-0.021,-2.15%,70901711,United States,,567692,Technology,Computer Software: Prepackaged Software
RCB,Ready Capital Corporation 6.20% Senior Notes due 2026,$24.04 ,-0.06,-0.25%,4059719108,United States,2019,1065,Real Estate,Real Estate Investment Trusts
RCC,Ready Capital Corporation 5.75% Senior Notes due 2026,$24.01 ,-0.0601,-0.25%,4054652903,United States,2021,4124,Real Estate,Real Estate Investment Trusts
RCEL,Avita Medical Inc. Common Stock,$8.84 ,-0.37,-4.02%,228069657,United States,,318526,Health Care,Medical/Dental Instruments
RCFA,Perception Capital Corp. IV Class A Ordinary Shares,$11.30 ,0.01,0.09%,0,,2021,155399,Finance,Blank Checks
RCG,RENN Fund Inc Common Stock,$1.62 ,0,0.00%,0,United States,,70,Finance,Investment Managers
RCI,Rogers Communication Inc. Common Stock,$40.07 ,-0.39,-0.96%,21287771280,Canada,,758653,,
RCKT,Rocket Pharmaceuticals Inc. Common Stock,$22.23 ,0.3,1.37%,2018088551,United States,2015,523597,Health Care,Biotechnology: Pharmaceutical Preparations
RCKTW,Rocket Pharmaceuticals Inc. Warrant,$0.12 ,0.003,2.57%,,United States,,627,Health Care,Biotechnology: Pharmaceutical Preparations
RCKY,Rocky Brands Inc. Common Stock,$37.55 ,-0.73,-1.91%,278740447,United States,1993,38948,Consumer Discretionary,Shoe Manufacturing
RCL,Royal Caribbean Cruises Ltd. Common Stock,$155.16 ,4.19,2.78%,39930301251,United States,1993,2601585,Consumer Discretionary,Marine Transportation
RCM,R1 RCM Inc. Common Stock,$12.77 ,-0.02,-0.16%,5379429287,United States,,973643,Consumer Discretionary,Other Consumer Services
RCMT,RCM Technologies Inc. Common Stock,$19.99 ,0.3,1.52%,154991825,United States,,44129,Consumer Discretionary,Professional Services
RCON,Recon Technology Ltd. Class A Ordinary Shares,$1.46 ,0.0501,3.55%,21869314,China,2009,11819,Energy,Oilfield Services/Equipment
RCRT,Recruiter.com Group Inc. Common Stock,$1.90 ,0.21,12.43%,5134419,United States,,30365,Technology,EDP Services
RCRTW,Recruiter.com Group Inc. Warrant,$0.01 ,-0.0029,-36.25%,13782,United States,,5515,Technology,EDP Services
RCS,PIMCO Strategic Income Fund Inc.,$6.16 ,0.02,0.33%,0,United States,1994,80503,Finance,Investment Managers
RCUS,Arcus Biosciences Inc. Common Stock,$16.00 ,0.16,1.01%,1455248176,United States,2018,498235,Health Care,Biotechnology: Pharmaceutical Preparations
RDCM,Radcom Ltd. Ordinary Shares,$9.39 ,-0.053,-0.56%,143739603,Israel,1997,10045,Technology,Computer peripheral equipment
RDDT,Reddit Inc. Class A Common Stock,$54.50 ,-1.3,-2.33%,8911254452,,2024,1288676,Technology,EDP Services
RDFN,Redfin Corporation Common Stock,$6.67 ,0.02,0.30%,796870776,United States,2017,3341441,Finance,Real Estate
RDHL,Redhill Biopharma Ltd. American Depositary Shares,$0.48 ,0.0275,6.15%,15136823,Israel,,366529,Health Care,Biotechnology: Pharmaceutical Preparations
RDI,Reading International Inc Class A Common Stock,$1.51 ,-0.04,-2.58%,33863878,United States,,22071,Consumer Discretionary,Movies/Entertainment
RDIB,Reading International Inc Class B Common Stock,$14.14 ,0.61,4.51%,317109423,United States,,2122,Consumer Discretionary,Movies/Entertainment
RDN,Radian Group Inc. Common Stock,$31.39 ,-0.49,-1.54%,4726658016,United States,,587455,Finance,Property-Casualty Insurers
RDNT,RadNet Inc. Common Stock,$58.34 ,-0.53,-0.90%,4310167659,United States,,369282,Health Care,Medical Specialities
RDUS,Radius Recycling Inc. Class A Common Stock,$16.18 ,-0.69,-4.09%,452751365,United States,,301656,Consumer Discretionary,Industrial Specialties
