Symbol,Name,Last Sale,Net Change,% Change,Market Cap,Country,IPO Year,Volume,Sector,Industry
DFIN,Donnelley Financial Solutions Inc. Common Stock ,$59.70 ,-0.42,-0.70%,1750157678,United States,2016,94649,Consumer Discretionary,Other Consumer Services
DFLI,Dragonfly Energy Holdings Corp. Common Stock (NV),$0.93 ,-0.0283,-2.96%,56098335,United States,2021,290942,Miscellaneous,Industrial Machinery/Components
DFLIW,Dragonfly Energy Holdings Corp. Warrant,$0.04 ,-0.0002,-0.45%,2662417,United States,2021,2000,Miscellaneous,Industrial Machinery/Components
DFP,Flaherty & Crumrine Dynamic Preferred and Income Fund Inc. Common Stock,$18.73 ,0.04,0.21%,0,,2013,55763,Finance,Investment Managers
DFS,Discover Financial Services Common Stock,$121.10 ,-1.71,-1.39%,30347543381,United States,,1024746,Finance,Finance: Consumer Services
DG,Dollar General Corporation Common Stock,$134.51 ,-5.05,-3.62%,29578029641,United States,2009,2794755,Consumer Discretionary,Department/Specialty Retail Stores
DGHI,Digihost Technology Inc. Common Subordinate Voting Shares,$1.31 ,0.07,5.65%,38422495,Canada,,75722,,
DGICA,Donegal Group Inc. Class A Common Stock,$13.18 ,-0.01,-0.08%,440125394,United States,,43075,Finance,Property-Casualty Insurers
DGICB,Donegal Group Inc. Class B Common Stock,$11.17 ,-1.0919,-8.91%,373004602,United States,1986,5170,Finance,Property-Casualty Insurers
DGII,Digi International Inc. Common Stock,$23.67 ,-0.18,-0.76%,860986664,United States,1989,217000,Technology,Computer peripheral equipment
DGLY,Digital Ally Inc. Common Stock,$3.03 ,-0.1687,-5.27%,8729329,United States,,5711,Technology,Radio And Television Broadcasting And Communications Equipment
DGX,Quest Diagnostics Incorporated Common Stock,$141.57 ,0.46,0.33%,15727234131,United States,,818752,Health Care,Medical Specialities
DH,Definitive Healthcare Corp. Class A Common Stock,$5.20 ,-0.04,-0.76%,613260508,United States,2021,608365,Technology,Computer Software: Prepackaged Software
DHAC,Digital Health Acquisition Corp. Common Stock,$21.01 ,3.67,21.17%,75719326,United States,2021,301446,Health Care,Medical/Nursing Services
DHACU,Digital Health Acquisition Corp. Unit,$23.06 ,6.66,40.61%,83107456,United States,2021,3945,Health Care,Medical/Nursing Services
DHACW,Digital Health Acquisition Corp. Warrant,$0.14 ,0.0448,44.80%,521854,United States,2021,108759,Health Care,Medical/Nursing Services
DHAI,DIH Holdings US Inc. Class A Common Stock,$1.54 ,-0.11,-6.67%,62439200,United States,2024,23087,Health Care,Medical/Dental Instruments
DHAIW,DIH Holding US Inc. Warrants,$0.03 ,-0.0041,-11.71%,1252838,United States,2024,24395,Health Care,Medical/Dental Instruments
DHC,Diversified Healthcare Trust Common Shares of Beneficial Interest,$2.75 ,0.23,9.13%,661082736,United States,,1132989,Real Estate,Real Estate Investment Trusts
DHCNI,Diversified Healthcare Trust 5.625% Senior Notes due 2042,$14.22 ,0.045,0.32%,3417196758,United States,,9558,Real Estate,Real Estate Investment Trusts
DHCNL,Diversified Healthcare Trust 6.25% Senior Notes Due 2046,$15.20 ,0.15,1.00%,3653984574,United States,,26388,Real Estate,Real Estate Investment Trusts
DHF,BNY Mellon High Yield Strategies Fund Common Stock,$2.44 ,0,0.00%,0,United States,1998,214991,Finance,Finance Companies
DHI,D.R. Horton Inc. Common Stock,$143.87 ,-3.06,-2.08%,47378153120,United States,,2448325,Consumer Discretionary,Homebuilding
DHIL,Diamond Hill Investment Group Inc. Class A Common Stock,$150.97 ,0.96,0.64%,418623203,United States,,16433,Finance,Investment Managers
DHR,Danaher Corporation Common Stock,$263.33 ,1.95,0.75%,1.95E+11,United States,,3119803,Industrials,Industrial Machinery/Components
DHT,DHT Holdings Inc.,$11.68 ,-0.32,-2.67%,1880474651,Jersey,2005,2178196,Consumer Discretionary,Marine Transportation
DHX,DHI Group Inc. Common Stock,$2.08 ,-0.03,-1.42%,100547452,United States,2007,131789,Consumer Discretionary,Business Services
DHY,Credit Suisse High Yield Bond Fund Common Stock,$2.06 ,0,0.00%,0,United States,1998,173231,Finance,Finance/Investors Services
DIAX,Nuveen Dow 30SM Dynamic Overwrite Fund Common Shares of Beneficial Interest,$14.01 ,0.08,0.57%,0,,2014,87221,Finance,Finance Companies
DIBS,1stdibs.com Inc. Common Stock,$5.56 ,-0.03,-0.54%,218929576,United States,2021,61050,Consumer Discretionary,Catalog/Specialty Distribution
DIN,Dine Brands Global Inc. Common Stock,$39.23 ,-0.89,-2.22%,604321242,United States,,290271,Consumer Discretionary,Restaurants
DINO,HF Sinclair Corporation Common Stock,$53.78 ,-0.12,-0.22%,10334227123,United States,1960,1522900,Energy,Oil & Gas Production
DIOD,Diodes Incorporated Common Stock,$71.91 ,-2.94,-3.93%,3316698027,United States,,247028,Technology,Semiconductors
DIS,Walt Disney Company (The) Common Stock,$103.33 ,0.56,0.55%,1.88E+11,United States,,7263251,Consumer Discretionary,Services-Misc. Amusement & Recreation
DIST,Distoken Acquisition Corporation Ordinary Shares,$10.74 ,0.02,0.19%,0,China,2023,788,Finance,Blank Checks
DISTR,Distoken Acquisition Corporation Right,$0.11 ,0,0.00%,0,China,2023,10,Finance,Blank Checks
DISTW,Distoken Acquisition Corporation Warrant,$0.02 ,0,0.00%,0,China,2023,2,Finance,Blank Checks
DIT,AMCON Distributing Company Common Stock,$141.00 ,1,0.71%,88881042,United States,1999,88,Consumer Discretionary,Food Distributors
DJCO,Daily Journal Corp. (S.C.) Common Stock,$368.15 ,-8.3,-2.21%,506952122,United States,,6040,Consumer Discretionary,Newspapers/Magazines
DJT,Trump Media & Technology Group Corp. Common Stock,$45.49 ,-1.25,-2.67%,8038109521,United States,2024,2655342,Technology,Computer Software: Programming Data Processing
DJTWW,Trump Media & Technology Group Corp. Warrants,$26.35 ,-0.04,-0.15%,4656060362,United States,2021,207500,Technology,Computer Software: Programming Data Processing
DK,Delek US Holdings Inc. Common Stock,$25.18 ,0.08,0.32%,1614820443,United States,2017,1653161,Energy,Integrated oil Companies
DKL,Delek Logistics Partners L.P. Common Units representing Limited Partner Interests,$39.75 ,-0.02,-0.05%,1876837988,United States,2012,55877,Energy,Natural Gas Distribution
DKNG,DraftKings Inc. Class A Common Stock,$35.52 ,0,0.00%,16915465575,United States,2019,11101398,Consumer Discretionary,Services-Misc. Amusement & Recreation
DKS,Dick's Sporting Goods Inc Common Stock,$220.57 ,-1.78,-0.80%,17974283488,United States,2002,1289790,Consumer Discretionary,Other Specialty Stores
DLA,Delta Apparel Inc. Common Stock,$1.20 ,0.06,5.26%,8461384,United States,2000,114179,Consumer Staples,Apparel
DLB,Dolby Laboratories Common Stock,$80.59 ,-0.21,-0.26%,7723377626,United States,2005,332387,Technology,EDP Services
DLHC,DLH Holdings Corp.,$11.56 ,0.08,0.70%,164532220,United States,,28559,Consumer Discretionary,Business Services
DLNG,Dynagas LNG Partners LP Common Units,$4.11 ,-0.06,-1.44%,151403247,Greece,,43478,Consumer Discretionary,Marine Transportation
DLNG^A,Dynagas LNG Partners LP 9.00% Series A Cumulative Redeemable Preferred Units,$25.72 ,-0.005,-0.02%,,Greece,,344,,
DLNG^B,Dynagas LNG Partners LP 8.75% Series B Fixed to Floating Rate Cumulative Redeemable Perpetual Preferred Units liquidation preference $25.00 per Uni,$25.80 ,-0.1,-0.39%,,Greece,,2499,,
DLO,DLocal Limited Class A Common Shares,$8.62 ,-0.18,-2.05%,2551448152,Uruguay,2021,2628501,Consumer Discretionary,Business Services
DLPN,Dolphin Entertainment Inc. Common Stock,$1.10 ,-0.04,-3.51%,20850403,United States,,18009,Consumer Discretionary,Other Consumer Services
DLR,Digital Realty Trust Inc. Common Stock,$145.12 ,2.08,1.45%,45339350224,United States,2004,1403894,Real Estate,Real Estate Investment Trusts
DLR^J,Digital Realty Trust Inc. 5.250% Series J Cumulative Redeemable Preferred Stock,$21.59 ,0.08,0.37%,,United States,,17425,,
DLR^K,Digital Realty Trust Inc. 5.850% Series K Cumulative Redeemable Preferred Stock par value $0.01 per share,$24.07 ,0.24,1.01%,,United States,,10967,,
DLR^L,Digital Realty Trust Inc. 5.200% Series L Cumulative Redeemable Preferred Stock,$21.33 ,-0.07,-0.33%,,United States,,22330,,
DLTH,Duluth Holdings Inc. Class B Common Stock,$3.77 ,0.01,0.27%,132196905,United States,2015,72279,Consumer Discretionary,Clothing/Shoe/Accessory Stores
DLTR,Dollar Tree Inc. Common Stock,$120.30 ,-0.68,-0.56%,26223357065,United States,1995,3511191,Consumer Discretionary,Department/Specialty Retail Stores
DLX,Deluxe Corporation Common Stock,$22.80 ,-0.32,-1.38%,1004245061,United States,,181470,Consumer Discretionary,Advertising
DLY,DoubleLine Yield Opportunities Fund Common Shares of Beneficial Interest,$15.63 ,0.02,0.13%,749392526,United States,2020,98161,Finance,Investment Managers
DM,Desktop Metal Inc. Class A Common Stock,$0.55 ,-0.032,-5.51%,181420421,United States,2019,1787765,Technology,Industrial Machinery/Components
DMA,Destra Multi-Alternative Fund Common Stock,$7.63 ,0.09,1.19%,0,,2022,7359,Finance,Trusts Except Educational Religious and Charitable
DMAC,DiaMedica Therapeutics Inc. Common Stock,$2.82 ,-0.13,-4.41%,107058243,United States,2018,23787,Health Care,Biotechnology: Pharmaceutical Preparations
DMB,BNY Mellon Municipal Bond Infrastructure Fund Inc. Common Stock,$10.24 ,0.07,0.69%,0,,2013,28137,Finance,Trusts Except Educational Religious and Charitable
DMF,BNY Mellon Municipal Income Inc. Common Stock,$6.80 ,0.04,0.59%,423577807,United States,1988,33443,Finance,Finance/Investors Services
DMLP,Dorchester Minerals L.P. Common Units Representing Limited Partnership Interests,$32.05 ,-0.16,-0.50%,1284840015,United States,,35098,Energy,Oil & Gas Production
DMO,Western Asset Mortgage Opportunity Fund Inc. Common Stock,$11.84 ,0.06,0.51%,0,United States,2010,61917,Finance,Trusts Except Educational Religious and Charitable
DMRC,Digimarc Corporation Common Stock,$28.12 ,0.25,0.90%,601017843,United States,,106815,Technology,EDP Services
DMTK,DermTech Inc. Common Stock,$0.31 ,0.006,1.98%,10803565,United States,2017,241573,Health Care,Medical Specialities
DMYY,dMY Squared Technology Group Inc. Class A Common Stock,$10.72 ,0.06,0.56%,0,,2022,5957,Finance,Blank Checks
DNA,Ginkgo Bioworks Holdings Inc. Class A Common Stock,$0.53 ,-0.0126,-2.33%,1169766045,United States,2021,37105572,Health Care,Biotechnology: Biological Products (No Diagnostic Substances)
DNB,Dun & Bradstreet Holdings Inc. Common Stock,$9.50 ,-0.09,-0.94%,4205816364,United States,2020,2911953,Finance,Finance: Consumer Services
DNLI,Denali Therapeutics Inc. Common Stock,$20.67 ,0.29,1.42%,2947728774,United States,2017,1290876,Health Care,Biotechnology: Biological Products (No Diagnostic Substances)
DNMR,Danimer Scientific Inc. Common Stock,$0.69 ,-0.0388,-5.32%,80476900,United States,2020,1143254,Industrials,Major Chemicals
DNN,Denison Mines Corp Ordinary Shares (Canada),$2.23 ,-0.14,-5.91%,1986921907,Canada,,22943444,Basic Materials,Other Metals and Minerals
DNOW,DNOW Inc. Common Stock,$13.61 ,-0.48,-3.41%,1453582692,United States,2014,924414,Industrials,Metal Fabrications
DNP,DNP Select Income Fund Inc. Common Stock,$8.58 ,-0.02,-0.23%,0,United States,1987,472790,Finance,Investment Managers
DNTH,Dianthus Therapeutics Inc. Common Stock,$21.74 ,-0.15,-0.69%,638057456,United States,2018,152252,Health Care,Biotechnology: Pharmaceutical Preparations
DNUT,Krispy Kreme Inc. Common Stock,$10.25 ,-0.38,-3.58%,1729175000,United States,2021,2492725,Consumer Staples,Food Chains
DO,Diamond Offshore Drilling Inc. Common Stock,$13.36 ,-0.72,-5.11%,1369149366,United States,2022,2214374,Energy,Oil & Gas Production
DOC,Healthpeak Properties Inc. Common Stock,$19.74 ,-0.03,-0.15%,13892647126,United States,,4677200,Real Estate,Real Estate Investment Trusts
DOCN,DigitalOcean Holdings Inc. Common Stock,$36.82 ,0.19,0.52%,3353982550,United States,2021,852243,Technology,Computer Software: Programming Data Processing
DOCS,Doximity Inc. Class A Common Stock,$27.71 ,0.07,0.25%,5138150387,United States,2021,926742,Technology,EDP Services
DOCU,DocuSign Inc. Common Stock,$53.20 ,-0.24,-0.45%,10928084863,United States,1989,2113658,Technology,EDP Services
DOGZ,Dogness (International) Corporation Class A Common Stock,$15.67 ,1.91,13.88%,166443026,China,2017,878572,Consumer Discretionary,Miscellaneous manufacturing industries
DOLE,Dole plc Ordinary Shares,$12.18 ,-0.13,-1.06%,1156237400,Ireland,2021,447697,Consumer Staples,Farming/Seeds/Milling
DOMA,Doma Holdings Inc. Common Stock,$5.87 ,0.03,0.51%,82251878,United States,2021,39933,Finance,Specialty Insurers
DOMH,Dominari Holdings Inc. Common Stock,$2.15 ,-0.16,-6.93%,12760072,United States,,11121,Health Care,Biotechnology: Pharmaceutical Preparations
DOMO,Domo Inc. Class B Common Stock,$6.59 ,-0.13,-1.94%,250625674,United States,2018,413144,Technology,Computer Software: Prepackaged Software
DOOO,BRP Inc. (Recreational Products) Common Subordinate Voting Shares,$61.62 ,-2.52,-3.93%,4618817620,Canada,,245598,,
DORM,Dorman Products Inc. Common Stock,$90.15 ,-1.6,-1.74%,2795819426,United States,,97103,Consumer Discretionary,Auto Parts:O.E.M.
DOUG,Douglas Elliman Inc. Common Stock,$1.06 ,-0.01,-0.94%,96904974,United States,2021,1430803,Finance,Real Estate
DOV,Dover Corporation Common Stock,$179.44 ,-1.85,-1.02%,24660467910,United States,,1242520,Industrials,Industrial Machinery/Components
DOW,Dow Inc. Common Stock ,$55.15 ,-0.92,-1.64%,38781801525,United States,2019,4599329,Industrials,Major Chemicals
DOX,Amdocs Limited Ordinary Shares,$76.80 ,-0.73,-0.94%,9012312499,Guernsey,,698382,Technology,EDP Services
DOYU,DouYu International Holdings Limited ADS,$10.12 ,0.11,1.10%,320152009,China,2019,78598,Technology,Computer Software: Programming Data Processing
DPCS,DP Cap Acquisition Corp I Class A Ordinary Shares,$11.19 ,-0.0599,-0.53%,0,United States,2021,605,Finance,Blank Checks
DPCSW,DP Cap Acquisition Corp I Warrants,$0.04 ,-0.0065,-15.66%,0,United States,2021,102000,Finance,Blank Checks
DPG,Duff & Phelps Utility and Infrastructure Fund Inc.,$10.07 ,0.09,0.90%,0,United States,2011,107265,Finance,Trusts Except Educational Religious and Charitable
DPRO,Draganfly Inc. Common Shares,$0.27 ,-0.0016,-0.59%,17002062,Canada,,271875,Industrials,Aerospace
DPSI,DecisionPoint Systems Inc. Common Stock,$10.17 ,0.04,0.40%,78115770,,2022,180234,Technology,Computer Software: Programming Data Processing
DPZ,Domino's Pizza Inc Common Stock,$520.98 ,-2,-0.38%,18171895453,United States,2004,485833,Consumer Discretionary,Food Distributors
DQ,DAQO New Energy Corp. American Depositary Shares each representing five ordinary shares,$21.91 ,-0.73,-3.22%,1446223251,China,2010,845490,Technology,Semiconductors
DRCT,Direct Digital Holdings Inc. Class A Common Stock,$2.21 ,-0.31,-12.30%,31537639,United States,2022,221534,Consumer Discretionary,Advertising
DRD,DRDGOLD Limited American Depositary Shares,$8.38 ,-0.17,-1.99%,724525339,South Africa,,281578,Basic Materials,Precious Metals
DRH,Diamondrock Hospitality Company Common Stock,$8.45 ,-0.1,-1.17%,1775044459,United States,2005,1081673,Real Estate,Real Estate Investment Trusts
DRH^A,Diamondrock Hospitality Company 8.250% Series A Cumulative Redeemable Preferred Stock,$25.65 ,-0.06,-0.23%,,United States,,7110,,
DRI,Darden Restaurants Inc. Common Stock,$149.81 ,-1.33,-0.88%,17881163850,United States,,790532,Consumer Discretionary,Restaurants
DRIO,DarioHealth Corp. Common Stock,$1.41 ,-0.06,-4.08%,42191783,Israel,,29120,Health Care,Medical/Dental Instruments
DRMA,Dermata Therapeutics Inc. Common Stock,$3.75 ,-0.0899,-2.34%,1665210,United States,2021,32955,Health Care,Biotechnology: Pharmaceutical Preparations
DRMAW,Dermata Therapeutics Inc. Warrant,$0.01 ,0,0.00%,3597,United States,2021,276,Health Care,Biotechnology: Pharmaceutical Preparations
DRQ,Dril-Quip Inc. Common Stock,$16.81 ,-0.92,-5.19%,578607243,United States,1997,350713,Industrials,Metal Fabrications
DRRX,DURECT Corporation Common Stock,$1.53 ,-0.12,-7.27%,47490253,United States,2000,183943,Health Care,Biotechnology: Pharmaceutical Preparations
DRS,Leonardo DRS Inc. Common Stock,$23.65 ,0,0.00%,6223310712,Israel,,428447,Industrials,Industrial Machinery/Components
DRTS,Alpha Tau Medical Ltd. Ordinary Shares,$2.64 ,0.01,0.38%,183930416,Israel,,4116,Health Care,Medical/Dental Instruments
DRTSW,Alpha Tau Medical Ltd. Warrant,$0.25 ,-0.0201,-7.44%,17410686,Israel,,3274,Health Care,Medical/Dental Instruments
DRUG,Bright Minds Biosciences Inc. Common Stock,$1.17 ,-0.03,-2.50%,5222689,Canada,,8754,Health Care,Pharmaceuticals and Biotechnology
DRVN,Driven Brands Holdings Inc. Common Stock,$11.17 ,-0.17,-1.50%,1832771198,United States,2021,844718,Consumer Discretionary,Automotive Aftermarket
DSGN,Design Therapeutics Inc. Common Stock,$4.06 ,-0.01,-0.25%,229369858,United States,2021,79763,Health Care,Biotechnology: Pharmaceutical Preparations
DSGR,Distribution Solutions Group Inc. Common Stock,$31.41 ,-0.65,-2.03%,1470264439,United States,,61319,Consumer Discretionary,Industrial Specialties
DSGX,Descartes Systems Group Inc. (The) Common Stock,$90.34 ,-0.69,-0.76%,7714145428,Canada,,170243,,
DSL,DoubleLine Income Solutions Fund Common Shares of Beneficial Interests,$12.62 ,0.11,0.88%,1287199969,United States,2013,238081,Finance,Trusts Except Educational Religious and Charitable
DSM,BNY Mellon Strategic Municipal Bond Fund Inc. Common Stock,$5.79 ,0.06,1.05%,0,United States,1989,128704,Finance,Investment Managers
DSP,Viant Technology Inc. Class A Common Stock,$9.26 ,0.14,1.54%,587959913,United States,2021,110065,Technology,Computer Software: Programming Data Processing
DSS,DSS Inc. Common Stock,$1.83 ,0,0.00%,12932193,United States,,7349,Consumer Discretionary,Containers/Packaging
DSU,Blackrock Debt Strategies Fund Inc. Common Stock,$10.96 ,-0.03,-0.27%,0,United States,1998,189265,Finance,Finance Companies
DSWL,Deswell Industries Inc. Common Shares,$2.54 ,0.04,1.60%,40475507,Macau,1995,1264,Industrials,Plastic Products
DSX,Diana Shipping inc. common stock,$3.00 ,-0.05,-1.64%,359888751,Greece,2005,443825,Consumer Discretionary,Marine Transportation
DSX^B,Diana Shipping Inc. Perpetual Preferred Shares Series B (Marshall Islands),$26.33 ,-0.0173,-0.07%,,Greece,,2533,,
DT,Dynatrace Inc. Common Stock,$45.88 ,0.41,0.90%,13641901024,United States,2019,3782599,Technology,EDP Services
DTB,DTE Energy Company 2020 Series G 4.375% Junior Subordinated Debentures due 2080,$20.01 ,0.13,0.65%,4140814252,United States,2020,19095,Utilities,Electric Utilities: Central
DTC,Solo Brands Inc. Class A Common Stock,$1.87 ,-0.02,-1.06%,170670793,United States,2021,177727,Consumer Discretionary,Recreational Games/Products/Toys
DTCK,Davis Commodities Limited Ordinary Shares,$1.15 ,0.08,7.48%,28175719,Singapore,2023,30602,Industrials,Farming/Seeds/Milling
DTE,DTE Energy Company Common Stock,$116.53 ,0.29,0.25%,24114397043,United States,,753708,Utilities,Electric Utilities: Central
DTF,DTF Tax-Free Income 2028 Term Fund Inc. Common Stock,$10.93 ,0.03,0.28%,76833167,United States,1991,3498,Finance,Investment Managers
DTG,DTE Energy Company 2021 Series E 4.375% Junior Subordinated Debentures,$20.33 ,0.14,0.69%,4207034171,United States,2021,23506,Utilities,Electric Utilities: Central
DTI,Drilling Tools International Corporation Common Stock,$6.21 ,-0.05,-0.80%,184862807,United States,2021,22935,Industrials,Metal Fabrications
DTIL,Precision BioSciences Inc. Common Stock,$13.23 ,0.13,0.99%,91625662,United States,2019,17541,Health Care,Biotechnology: Biological Products (No Diagnostic Substances)
DTM,DT Midstream Inc. Common Stock ,$67.93 ,1.07,1.60%,6596621163,United States,2021,987235,Utilities,Natural Gas Distribution
DTSS,Datasea Inc. Common Stock,$4.74 ,0.21,4.64%,14494655,China,,53187,Technology,Computer Software: Prepackaged Software
DTST,Data Storage Corporation Common Stock,$6.27 ,-0.63,-9.13%,43707813,United States,,192910,Technology,EDP Services
DTSTW,Data Storage Corporation Warrant,$1.10 ,0,0.00%,7668037,United States,,369,Technology,EDP Services
DTW,DTE Energy Company 2017 Series E 5.25% Junior Subordinated Debentures due 2077,$23.37 ,0.0217,0.09%,4836475186,United States,2017,8484,Utilities,Electric Utilities: Central
DUET,DUET Acquisition Corp. Class A Common Stock,$11.05 ,0,0.00%,0,Malaysia,2022,100,Finance,Blank Checks
DUK,Duke Energy Corporation (Holding Company) Common Stock,$104.60 ,1.19,1.15%,80726996815,United States,,4822573,Utilities,Power Generation
DUK^A,Duke Energy Corporation Depositary Shares each representing a 1/1000th interest in a share of 5.75% Series A Cumulative Redeemable Perpetual Preferred Stock,$25.10 ,0.11,0.44%,,United States,,45740,,
DUKB,Duke Energy Corporation 5.625% Junior Subordinated Debentures due 2078,$24.82 ,0.17,0.69%,19155296950,United States,2018,20492,Utilities,Power Generation
DUO,Fangdd Network Group Ltd. American Depositary Shares,$0.75 ,0.0152,2.06%,4533792,China,2019,296821,Finance,Real Estate
DUOL,Duolingo Inc. Class A Common Stock,$192.67 ,-7.87,-3.92%,8308338475,United States,2021,558795,Technology,Computer Software: Prepackaged Software
DUOT,Duos Technologies Group Inc. Common Stock,$2.26 ,-0.04,-1.74%,17022288,United States,,41517,Technology,Computer Software: Prepackaged Software
DV,DoubleVerify Holdings Inc. Common Stock,$17.59 ,-0.41,-2.28%,3021899397,United States,2021,2523843,Technology,Computer Software: Programming Data Processing
DVA,DaVita Inc. Common Stock,$143.31 ,-2.3,-1.58%,12568287000,United States,,613206,Health Care,Misc Health and Biotechnology Services
DVAX,Dynavax Technologies Corporation Common Stock,$12.08 ,-0.24,-1.95%,1581171857,United States,2004,1266260,Health Care,Biotechnology: Pharmaceutical Preparations
DVN,Devon Energy Corporation Common Stock,$46.65 ,-0.43,-0.91%,29482800000,United States,1985,7659577,Energy,Oil & Gas Production
DWSN,Dawson Geophysical Company Common Stock,$1.98 ,0,0.00%,61008411,United States,,8612,Energy,Oil & Gas Production
DX,Dynex Capital Inc. Common Stock,$12.33 ,-0.01,-0.08%,791104279,United States,,611814,Real Estate,Real Estate Investment Trusts
DX^C,Dynex Capital Inc. 6.900% Series C Fixed-to-Floating Rate Cumulative Redeemable Preferred Stock,$24.70 ,0.0001,0.00%,,United States,,3284,,
DXC,DXC Technology Company Common Stock ,$15.46 ,-0.27,-1.72%,2827180187,United States,,2916762,Technology,EDP Services
DXCM,DexCom Inc. Common Stock,$116.71 ,1.48,1.28%,46413680616,United States,2005,2904354,Health Care,Medical/Dental Instruments
DXF,Dunxin Financial Holdings Limited American Depositary Shares,$0.26 ,-0.0053,-2.03%,5726026,China,,1376537,Finance,Finance: Consumer Services
DXLG,Destination XL Group Inc. Common Stock,$3.67 ,0.06,1.66%,213696955,United States,,261792,Consumer Discretionary,Clothing/Shoe/Accessory Stores
DXPE,DXP Enterprises Inc. Common Stock,$47.38 ,-1.15,-2.37%,754683091,United States,,93781,Industrials,Industrial Machinery/Components
DXR,Daxor Corporation Common Stock,$8.76 ,0,0.00%,36758554,United States,,3413,Health Care,Medical/Dental Instruments
DXYN,Dixie Group Inc. (The) Common Stock,$0.91 ,-0.0225,-2.42%,14420044,United States,,78930,Consumer Discretionary,Home Furnishings
DXYZ,Destiny Tech100 Inc. Common Stock,$13.80 ,-0.02,-0.15%,0,,2024,271545,,
DY,Dycom Industries Inc. Common Stock,$175.95 ,-3.17,-1.77%,5118945725,United States,,211164,Industrials,Water Sewer Pipeline Comm & Power Line Construction
DYAI,Dyadic International Inc. Common Stock,$2.15 ,-0.0008,-0.04%,62835761,United States,,50530,Health Care,Biotechnology: Biological Products (No Diagnostic Substances)
DYCQ,DT Cloud Acquisition Corporation Ordinary Shares,$10.19 ,0,0.00%,0,United Kingdom,2024,3000,,
DYCQU,DT Cloud Acquisition Corporation Unit,$10.48 ,-0.27,-2.51%,0,United Kingdom,2024,100,,
DYN,Dyne Therapeutics Inc. Common Stock,$31.41 ,0,0.00%,2744688660,United States,2020,915257,Health Care,Biotechnology: Pharmaceutical Preparations
DYNT,Dynatronics Corporation Common Stock,$0.42 ,-0.0099,-2.30%,2229578,United States,,28963,Health Care,Medical/Dental Instruments
DZSI,DZS Inc. Common Stock,$1.55 ,-0.005,-0.32%,48297656,United States,,34188,Utilities,Telecommunications Equipment
E,ENI S.p.A. Common Stock,$30.58 ,-0.69,-2.21%,51618090399,Italy,,685403,Energy,Oil & Gas Production
EA,Electronic Arts Inc. Common Stock,$136.50 ,3.51,2.64%,36360695144,United States,,2346712,Technology,Computer Software: Prepackaged Software
EAD,Allspring Income Opportunities Fund Common Shares,$6.61 ,0.05,0.76%,0,United States,2003,146144,Finance,Finance/Investors Services
EAF,GrafTech International Ltd. Common Stock,$1.42 ,-0.07,-4.70%,365177320,United States,2018,2083096,Energy,Industrial Machinery/Components
EAI,Entergy Arkansas LLC First Mortgage Bonds 4.875% Series Due September 1 2066,$21.57 ,0.11,0.51%,4605991710,United States,2016,17519,Utilities,Electric Utilities: Central
EARN,Ellington Credit Company Common Shares of Beneficial Interest,$6.96 ,0.04,0.58%,140136412,United States,2013,235601,Real Estate,Real Estate Investment Trusts
EAST,Eastside Distilling Inc. Common Stock,$0.97 ,-0.0701,-6.74%,1656348,United States,,44330,Consumer Staples,Beverages (Production/Distribution)
EAT,Brinker International Inc. Common Stock,$71.66 ,0.05,0.07%,3188190377,United States,,1125058,Consumer Discretionary,Restaurants
EB,Eventbrite Inc. Class A Common Stock,$4.87 ,0.11,2.31%,472951384,United States,2018,3009067,Technology,Computer Software: Programming Data Processing
EBAY,eBay Inc. Common Stock,$53.75 ,0.14,0.26%,27197500000,United States,1998,5009668,Consumer Discretionary,Business Services
EBC,Eastern Bankshares Inc. Common Stock,$13.29 ,-0.3,-2.21%,2347432329,United States,2020,616730,Finance,Savings Institutions
EBF,Ennis Inc. Common Stock,$21.05 ,0.03,0.14%,546963495,United States,,56274,Consumer Discretionary,Office Equipment/Supplies/Services
EBMT,Eagle Bancorp Montana Inc. Common Stock,$13.15 ,-0.05,-0.38%,105420710,United States,2010,7785,Finance,Major Banks
